{
 "description": "IEEE 39-Bus New England, matched to PowerFactory project \"39 Bus New England System\" study case \"1. Power Flow\" (grid \"Grid\", 60 Hz). True-PH: every dynamic component carries an energy reservoir. Generated by study/src/build_ieee39_case.py -- do not hand-edit. WP-G case \"gfl\": plants G 02+G 03+G 05+G 06+G 07+G 08 replaced by GFL_PHTRUE.",
 "config": {
  "mva_base": 100.0,
  "fn": 60.0,
  "omega_b": "2.0 * M_PI * 60.0",
  "description": "WP-G gfl -- 6 plants converted"
 },
 "Bus": [
  {
   "idx": 1,
   "name": "BUS1",
   "Vn": 345.0,
   "v0": 1.047356,
   "a0": -0.1472830995880455,
   "area": 1,
   "zone": 1
  },
  {
   "idx": 2,
   "name": "BUS2",
   "Vn": 345.0,
   "v0": 1.048736,
   "a0": -0.10042275450124974,
   "area": 1,
   "zone": 1
  },
  {
   "idx": 3,
   "name": "BUS3",
   "Vn": 345.0,
   "v0": 1.030173,
   "a0": -0.15007213573273243,
   "area": 1,
   "zone": 1
  },
  {
   "idx": 4,
   "name": "BUS4",
   "Vn": 345.0,
   "v0": 1.003863,
   "a0": -0.16766854525133926,
   "area": 1,
   "zone": 1
  },
  {
   "idx": 5,
   "name": "BUS5",
   "Vn": 345.0,
   "v0": 1.005311,
   "a0": -0.15030600985249967,
   "area": 1,
   "zone": 1
  },
  {
   "idx": 6,
   "name": "BUS6",
   "Vn": 345.0,
   "v0": 1.007672,
   "a0": -0.13874843954579322,
   "area": 1,
   "zone": 1
  },
  {
   "idx": 7,
   "name": "BUS7",
   "Vn": 345.0,
   "v0": 0.997001,
   "a0": -0.1766936428134019,
   "area": 1,
   "zone": 1
  },
  {
   "idx": 8,
   "name": "BUS8",
   "Vn": 345.0,
   "v0": 0.99602,
   "a0": -0.18527368141620604,
   "area": 1,
   "zone": 1
  },
  {
   "idx": 9,
   "name": "BUS9",
   "Vn": 345.0,
   "v0": 1.028226,
   "a0": -0.1801528853908547,
   "area": 1,
   "zone": 1
  },
  {
   "idx": 10,
   "name": "BUS10",
   "Vn": 345.0,
   "v0": 1.017151,
   "a0": -0.09472076383498426,
   "area": 1,
   "zone": 1
  },
  {
   "idx": 11,
   "name": "BUS11",
   "Vn": 345.0,
   "v0": 1.012694,
   "a0": -0.10968172618307966,
   "area": 1,
   "zone": 1
  },
  {
   "idx": 12,
   "name": "BUS12",
   "Vn": 138.0,
   "v0": 1.000151,
   "a0": -0.10897137717751795,
   "area": 1,
   "zone": 1
  },
  {
   "idx": 13,
   "name": "BUS13",
   "Vn": 345.0,
   "v0": 1.014307,
   "a0": -0.10642494179885822,
   "area": 1,
   "zone": 1
  },
  {
   "idx": 14,
   "name": "BUS14",
   "Vn": 345.0,
   "v0": 1.011733,
   "a0": -0.13362938884969383,
   "area": 1,
   "zone": 1
  },
  {
   "idx": 15,
   "name": "BUS15",
   "Vn": 345.0,
   "v0": 1.015384,
   "a0": -0.13502041626353334,
   "area": 1,
   "zone": 1
  },
  {
   "idx": 16,
   "name": "BUS16",
   "Vn": 345.0,
   "v0": 1.031774,
   "a0": -0.10799224746714914,
   "area": 1,
   "zone": 1
  },
  {
   "idx": 17,
   "name": "BUS17",
   "Vn": 345.0,
   "v0": 1.033555,
   "a0": -0.127431724675862,
   "area": 1,
   "zone": 1
  },
  {
   "idx": 18,
   "name": "BUS18",
   "Vn": 345.0,
   "v0": 1.030931,
   "a0": -0.14353413235476167,
   "area": 1,
   "zone": 1
  },
  {
   "idx": 19,
   "name": "BUS19",
   "Vn": 345.0,
   "v0": 1.049861,
   "a0": -0.017851227589398,
   "area": 1,
   "zone": 1
  },
  {
   "idx": 20,
   "name": "BUS20",
   "Vn": 230.0,
   "v0": 0.991177,
   "a0": -0.03516314843992976,
   "area": 1,
   "zone": 1
  },
  {
   "idx": 21,
   "name": "BUS21",
   "Vn": 345.0,
   "v0": 1.03176,
   "a0": -0.06598217237164562,
   "area": 1,
   "zone": 1
  },
  {
   "idx": 22,
   "name": "BUS22",
   "Vn": 345.0,
   "v0": 1.049795,
   "a0": 0.011664035391078104,
   "area": 1,
   "zone": 1
  },
  {
   "idx": 23,
   "name": "BUS23",
   "Vn": 345.0,
   "v0": 1.044789,
   "a0": 0.008203047484373348,
   "area": 1,
   "zone": 1
  },
  {
   "idx": 24,
   "name": "BUS24",
   "Vn": 345.0,
   "v0": 1.037311,
   "a0": -0.10590483368176393,
   "area": 1,
   "zone": 1
  },
  {
   "idx": 25,
   "name": "BUS25",
   "Vn": 345.0,
   "v0": 1.057568,
   "a0": -0.07615569658152058,
   "area": 1,
   "zone": 1
  },
  {
   "idx": 26,
   "name": "BUS26",
   "Vn": 345.0,
   "v0": 1.052075,
   "a0": -0.09645911176997062,
   "area": 1,
   "zone": 1
  },
  {
   "idx": 27,
   "name": "BUS27",
   "Vn": 345.0,
   "v0": 1.037741,
   "a0": -0.13081940875398299,
   "area": 1,
   "zone": 1
  },
  {
   "idx": 28,
   "name": "BUS28",
   "Vn": 345.0,
   "v0": 1.050122,
   "a0": -0.03516663909843375,
   "area": 1,
   "zone": 1
  },
  {
   "idx": 29,
   "name": "BUS29",
   "Vn": 345.0,
   "v0": 1.049942,
   "a0": 0.012992230951845788,
   "area": 1,
   "zone": 1
  },
  {
   "idx": 30,
   "name": "BUS30",
   "Vn": 16.5,
   "v0": 1.0475,
   "a0": -0.05818927726149095,
   "area": 1,
   "zone": 1
  },
  {
   "idx": 31,
   "name": "BUS31",
   "Vn": 16.5,
   "v0": 0.982,
   "a0": 0.0,
   "area": 1,
   "zone": 1
  },
  {
   "idx": 32,
   "name": "BUS32",
   "Vn": 16.5,
   "v0": 0.9831,
   "a0": 0.04483750848373433,
   "area": 1,
   "zone": 1
  },
  {
   "idx": 33,
   "name": "BUS33",
   "Vn": 16.5,
   "v0": 0.9972,
   "a0": 0.07321132613340614,
   "area": 1,
   "zone": 1
  },
  {
   "idx": 34,
   "name": "BUS34",
   "Vn": 16.5,
   "v0": 1.0123,
   "a0": 0.05541420375081996,
   "area": 1,
   "zone": 1
  },
  {
   "idx": 35,
   "name": "BUS35",
   "Vn": 16.5,
   "v0": 1.0493,
   "a0": 0.09826378221653274,
   "area": 1,
   "zone": 1
  },
  {
   "idx": 36,
   "name": "BUS36",
   "Vn": 16.5,
   "v0": 1.0635,
   "a0": 0.14526200831423605,
   "area": 1,
   "zone": 1
  },
  {
   "idx": 37,
   "name": "BUS37",
   "Vn": 16.5,
   "v0": 1.0278,
   "a0": 0.042256166520034714,
   "area": 1,
   "zone": 1
  },
  {
   "idx": 38,
   "name": "BUS38",
   "Vn": 16.5,
   "v0": 1.0265,
   "a0": 0.13627007200796126,
   "area": 1,
   "zone": 1
  },
  {
   "idx": 39,
   "name": "BUS39",
   "Vn": 345.0,
   "v0": 1.03,
   "a0": -0.17545794970298997,
   "area": 1,
   "zone": 1
  }
 ],
 "PQ": [
  {
   "idx": "PQ_1",
   "bus": 3,
   "p0": 3.22,
   "q0": 0.024,
   "Vn": 345.0
  },
  {
   "idx": "PQ_2",
   "bus": 4,
   "p0": 5.0,
   "q0": 1.84,
   "Vn": 345.0
  },
  {
   "idx": "PQ_3",
   "bus": 7,
   "p0": 2.33800003,
   "q0": 0.84,
   "Vn": 345.0
  },
  {
   "idx": "PQ_4",
   "bus": 8,
   "p0": 5.22,
   "q0": 1.76,
   "Vn": 345.0
  },
  {
   "idx": "PQ_5",
   "bus": 12,
   "p0": 0.075,
   "q0": 0.88,
   "Vn": 138.0
  },
  {
   "idx": "PQ_6",
   "bus": 15,
   "p0": 3.2,
   "q0": 1.53,
   "Vn": 345.0
  },
  {
   "idx": "PQ_7",
   "bus": 16,
   "p0": 3.29,
   "q0": 0.32299999,
   "Vn": 345.0
  },
  {
   "idx": "PQ_8",
   "bus": 18,
   "p0": 1.58,
   "q0": 0.3,
   "Vn": 345.0
  },
  {
   "idx": "PQ_9",
   "bus": 20,
   "p0": 6.28,
   "q0": 1.03,
   "Vn": 230.0
  },
  {
   "idx": "PQ_10",
   "bus": 21,
   "p0": 2.74,
   "q0": 1.15,
   "Vn": 345.0
  },
  {
   "idx": "PQ_11",
   "bus": 23,
   "p0": 2.475,
   "q0": 0.84599998,
   "Vn": 345.0
  },
  {
   "idx": "PQ_12",
   "bus": 24,
   "p0": 3.08600006,
   "q0": -0.92199997,
   "Vn": 345.0
  },
  {
   "idx": "PQ_13",
   "bus": 25,
   "p0": 2.24,
   "q0": 0.47200001,
   "Vn": 345.0
  },
  {
   "idx": "PQ_14",
   "bus": 26,
   "p0": 1.39,
   "q0": 0.17,
   "Vn": 345.0
  },
  {
   "idx": "PQ_15",
   "bus": 27,
   "p0": 2.81,
   "q0": 0.755,
   "Vn": 345.0
  },
  {
   "idx": "PQ_16",
   "bus": 28,
   "p0": 2.06,
   "q0": 0.276,
   "Vn": 345.0
  },
  {
   "idx": "PQ_17",
   "bus": 29,
   "p0": 2.835,
   "q0": 0.269,
   "Vn": 345.0
  },
  {
   "idx": "PQ_18",
   "bus": 31,
   "p0": 0.092,
   "q0": 0.046,
   "Vn": 16.5
  },
  {
   "idx": "PQ_19",
   "bus": 39,
   "p0": 11.04,
   "q0": 2.5,
   "Vn": 345.0
  }
 ],
 "PV": [
  {
   "bus": 30,
   "v0": 1.0475000143051147,
   "Sn": 1000.0,
   "Vn": 16.5,
   "p0": 2.5,
   "q0": 1.46158178,
   "pmax": 10.0,
   "pmin": 0.0,
   "qmax": 6.0,
   "qmin": -4.0,
   "idx": 30
  },
  {
   "bus": 31,
   "v0": 0.9819999933242798,
   "Sn": 700.0,
   "Vn": 16.5,
   "p0": 5.20811072,
   "pmax": 7.0,
   "pmin": 0.0,
   "qmax": 4.2,
   "qmin": -2.8,
   "idx": 31,
   "q0": 1.98251784
  },
  {
   "bus": 32,
   "v0": 0.9830999970436096,
   "Sn": 800.0,
   "Vn": 16.5,
   "p0": 6.5,
   "q0": 2.05144371,
   "pmax": 8.0,
   "pmin": 0.0,
   "qmax": 4.8,
   "qmin": -3.2,
   "idx": 32
  },
  {
   "bus": 33,
   "v0": 0.9972000122070312,
   "Sn": 800.0,
   "Vn": 16.5,
   "p0": 6.32,
   "q0": 1.09905981,
   "pmax": 8.0,
   "pmin": 0.0,
   "qmax": 4.8,
   "qmin": -3.2,
   "idx": 33
  },
  {
   "bus": 34,
   "v0": 1.0123000144958496,
   "Sn": 600.0,
   "Vn": 16.5,
   "p0": 5.08,
   "q0": 1.65763649,
   "pmax": 6.0,
   "pmin": 0.0,
   "qmax": 3.6,
   "qmin": -2.4,
   "idx": 34
  },
  {
   "bus": 35,
   "v0": 1.049299955368042,
   "Sn": 800.0,
   "Vn": 16.5,
   "p0": 6.5,
   "q0": 2.12411827,
   "pmax": 8.0,
   "pmin": 0.0,
   "qmax": 4.8,
   "qmin": -3.2,
   "idx": 35
  },
  {
   "bus": 36,
   "v0": 1.0635000467300415,
   "Sn": 700.0,
   "Vn": 16.5,
   "p0": 5.6,
   "q0": 1.0117501,
   "pmax": 7.0,
   "pmin": 0.0,
   "qmax": 4.2,
   "qmin": -2.8,
   "idx": 36
  },
  {
   "bus": 37,
   "v0": 1.0277999639511108,
   "Sn": 700.0,
   "Vn": 16.5,
   "p0": 5.4,
   "q0": 0.00439926,
   "pmax": 7.0,
   "pmin": 0.0,
   "qmax": 4.2,
   "qmin": -2.8,
   "idx": 37
  },
  {
   "bus": 38,
   "v0": 1.0264999866485596,
   "Sn": 1000.0,
   "Vn": 16.5,
   "p0": 8.3,
   "q0": 0.22841625,
   "pmax": 10.0,
   "pmin": 0.0,
   "qmax": 6.0,
   "qmin": -4.0,
   "idx": 38
  }
 ],
 "Slack": [
  {
   "bus": 39,
   "v0": 1.0299999713897705,
   "Sn": 10000.0,
   "Vn": 345.0,
   "p0": 10.0,
   "pmax": 100.0,
   "pmin": 0.0,
   "qmax": 60.0,
   "qmin": -40.0,
   "idx": 39,
   "a0": 0.0
  }
 ],
 "Line": [
  {
   "idx": "Line_1",
   "bus1": 1,
   "bus2": 2,
   "r": 0.0035,
   "x": 0.0411,
   "b": 0.69869962,
   "tap": 1.0,
   "Vn1": 345.0,
   "Vn2": 345.0,
   "_pf": "Line 01 - 02"
  },
  {
   "idx": "Line_2",
   "bus1": 1,
   "bus2": 39,
   "r": 0.001,
   "x": 0.025,
   "b": 0.75000167,
   "tap": 1.0,
   "Vn1": 345.0,
   "Vn2": 345.0,
   "_pf": "Line 01 - 39"
  },
  {
   "idx": "Line_3",
   "bus1": 2,
   "bus2": 3,
   "r": 0.0013,
   "x": 0.0151,
   "b": 0.25719987,
   "tap": 1.0,
   "Vn1": 345.0,
   "Vn2": 345.0,
   "_pf": "Line 02 - 03"
  },
  {